### ISSUE TITLE
keepalive support check

### ISSUE THREAD

**Issue by MindHunter86** [MindHunter86/anilibria-hlp-service#45]
```
13:28:07.392287 IP 127.0.0.1.8089 > 127.0.0.1.48576: Flags [S.], seq 2708045960, ack 3101577348, win 43690, options [mss 65495,sackOK,TS val 3613697252 ecr 3613697252,nop,wscale 11], length 0
13:28:07.393858 IP 127.0.0.1.48592 > 127.0.0.1.8089: Flags [S], seq 2967456395, win 43690, options [mss 65495,sackOK,TS val 3613697254 ecr 3613662230,nop,wscale 11], length 0
13:28:07.393865 IP 127.0.0.1.8089 > 127.0.0.1.48592: Flags [S.], seq 444273248, ack 2967456396, win 43690, options [mss 65495,sackOK,TS val 3613697254 ecr 3613697254,nop,wscale 11], length 0
13:28:07.395794 IP 127.0.0.1.48596 > 127.0.0.1.8089: Flags [S], seq 3507550068, win 43690, options [mss 65495,sackOK,TS val 3613697256 ecr 0,nop,wscale 11], length 0
13:28:07.395799 IP 127.0.0.1.8089 > 127.0.0.1.48596: Flags [S.], seq 694284797, ack 3507550069, win 43690, options [mss 65495,sackOK,TS val 3613697256 ecr 3613697256,nop,wscale 11], length 0
13:28:07.395890 IP 127.0.0.1.48600 > 127.0.0.1.8089: Flags [S], seq 587469951, win 43690, options [mss 65495,sackOK,TS val 3613697256 ecr 3613674895,nop,wscale 11], length 0
13:28:07.395895 IP 127.0.0.1.8089 > 127.0.0.1.48600: Flags [S.], seq 3142762653, ack 587469952, win 43690, options [mss 65495,sackOK,TS val 3613697256 ecr 3613697256,nop,wscale 11], length 0
13:28:07.402939 IP 127.0.0.1.48612 > 127.0.0.1.8089: Flags [S], seq 261994710, win 43690, options [mss 65495,sackOK,TS val 3613697263 ecr 0,nop,wscale 11], length 0
13:28:07.402944 IP 127.0.0.1.8089 > 127.0.0.1.48612: Flags [S.], seq 3948940758, ack 261994711, win 43690, options [mss 65495,sackOK,TS val 3613697263 ecr 3613697263,nop,wscale 11], length 0
13:28:07.403617 IP 127.0.0.1.48622 > 127.0.0.1.8089: Flags [S], seq 111722333, win 43690, options [mss 65495,sackOK,TS val 3613697264 ecr 0,nop,wscale 11], length 0
13:28:07.403622 IP 127.0.0.1.8089 > 127.0.0.1.48622: Flags [S.], seq 2458276047, ack 111722334, win 43690, options [mss 65495,sackOK,TS val 3613697264 ecr 3613697264,nop,wscale 11], length 0
13:28:07.409992 IP 127.0.0.1.48624 > 127.0.0.1.8089: Flags [S], seq 423220565, win 43690, options [mss 65495,sackOK,TS val 3613697270 ecr 3613662238,nop,wscale 11], length 0
13:28:07.409998 IP 127.0.0.1.8089 > 127.0.0.1.48624: Flags [S.], seq 570471549, ack 423220566, win 43690, options [mss 65495,sackOK,TS val 3613697270 ecr 3613697270,nop,wscale 11], length 0
13:28:07.413201 IP 127.0.0.1.48628 > 127.0.0.1.8089: Flags [S], seq 2558937, win 43690, options [mss 65495,sackOK,TS val 3613697273 ecr 3613662240,nop,wscale 11], length 0
13:28:07.413206 IP 127.0.0.1.8089 > 127.0.0.1.48628: Flags [S.], seq 2690697728, ack 2558938, win 43690, options [mss 65495,sackOK,TS val 3613697273 ecr 3613697273,nop,wscale 11], length 0
13:28:07.413484 IP 127.0.0.1.48640 > 127.0.0.1.8089: Flags [S], seq 4055799732, win 43690, options [mss 65495,sackOK,TS val 3613697273 ecr 3613643936,nop,wscale 11], length 0
13:28:07.413490 IP 127.0.0.1.8089 > 127.0.0.1.48640: Flags [S.], seq 183499375, ack 4055799733, win 43690, options [mss 65495,sackOK,TS val 3613697273 ecr 3613697273,nop,wscale 11], length 0
13:28:07.417197 IP 127.0.0.1.48650 > 127.0.0.1.8089: Flags [S], seq 1529512637, win 43690, options [mss 65495,sackOK,TS val 3613697277 ecr 3613674903,nop,wscale 11], length 0
13:28:07.417202 IP 127.0.0.1.8089 > 127.0.0.1.48650: Flags [S.], seq 3486317543, ack 1529512638, win 43690, options [mss 65495,sackOK,TS val 3613697277 ecr 3613697277,nop,wscale 11], length 0
13:28:07.420308 IP 127.0.0.1.48666 > 127.0.0.1.8089: Flags [S], seq 3924097511, win 43690, options [mss 65495,sackOK,TS val 3613697280 ecr 3613657606,nop,wscale 11], length 0
13:28:07.420324 IP 127.0.0.1.8089 > 127.0.0.1.48666: Flags [S.], seq 1058208436, ack 3924097512, win 43690, options [mss 65495,sackOK,TS val 3613697280 ecr 3613697280,nop,wscale 11], length 0
13:28:07.427449 IP 127.0.0.1.48670 > 127.0.0.1.8089: Flags [S], seq 1757285592, win 43690, options [mss 65495,sackOK,TS val 3613697287 ecr 3613662247,nop,wscale 11], length 0
13:28:07.427455 IP 127.0.0.1.8089 > 127.0.0.1.48670: Flags [S.], seq 2590929877, ack 1757285593, win 43690, options [mss 65495,sackOK,TS val 3613697287 ecr 3613697287,nop,wscale 11], length 0
13:28:07.427974 IP 127.0.0.1.48684 > 127.0.0.1.8089: Flags [S], seq 3663972501, win 43690, options [mss 65495,sackOK,TS val 3613697288 ecr 0,nop,wscale 11], length 0
13:28:07.427983 IP 127.0.0.1.8089 > 127.0.0.1.48684: Flags [S.], seq 575791961, ack 3663972502, win 43690, options [mss 65495,sackOK,TS val 3613697288 ecr 3613697288,nop,wscale 11], length 0
13:28:07.435105 IP 127.0.0.1.48692 > 127.0.0.1.8089: Flags [S], seq 1860041805, win 43690, options [mss 65495,sackOK,TS val 3613697295 ecr 3613662257,nop,wscale 11], length 0
13:28:07.435111 IP 127.0.0.1.8089 > 127.0.0.1.48692: Flags [S.], seq 2643564951, ack 1860041806, win 43690, options [mss 65495,sackOK,TS val 3613697295 ecr 3613697295,nop,wscale 11], length 0
13:28:07.436618 IP 127.0.0.1.48704 > 127.0.0.1.8089: Flags [S], seq 1945105533, win 43690, options [mss 65495,sackOK,TS val 3613697297 ecr 0,nop,wscale 11], length 0
13:28:07.436624 IP 127.0.0.1.8089 > 127.0.0.1.48704: Flags [S.], seq 869652297, ack 1945105534, win 43690, options [mss 65495,sackOK,TS val 3613697297 ecr 3613697297,nop,wscale 11], length 0
13:28:07.439768 IP 127.0.0.1.48714 > 127.0.0.1.8089: Flags [S], seq 1750289726, win 43690, options [mss 65495,sackOK,TS val 3613697300 ecr 3613662274,nop,wscale 11], length 0
13:28:07.439773 IP 127.0.0.1.8089 > 127.0.0.1.48714: Flags [S.], seq 4206094416, ack 1750289727, win 43690, options [mss 65495,sackOK,TS val 3613697300 ecr 3613697300,nop,wscale 11], length 0
13:28:07.447019 IP 127.0.0.1.48722 > 127.0.0.1.8089: Flags [S], seq 131175622, win 43690, options [mss 65495,sackOK,TS val 3613697307 ecr 0,nop,wscale 11], length 0
13:28:07.447027 IP 127.0.0.1.8089 > 127.0.0.1.48722: Flags [S.], seq 748633730, ack 131175623, win 43690, options [mss 65495,sackOK,TS val 3613697307 ecr 3613697307,nop,wscale 11], length 0
13:28:07.450547 IP 127.0.0.1.48734 > 127.0.0.1.8089: Flags [S], seq 2167440984, win 43690, options [mss 65495,sackOK,TS val 3613697310 ecr 0,nop,wscale 11], length 0
13:28:07.450555 IP 127.0.0.1.8089 > 127.0.0.1.48734: Flags [S.], seq 2131807477, ack 2167440985, win 43690, options [mss 65495,sackOK,TS val 3613697310 ecr 3613697310,nop,wscale 11], length 0

```
